{"analysisHash":"8079544e5726f62a42f2f1288e63e3dbbf147858ea78c7bb1f8abc0b7fe7e9c5","claimsHash":"e77e1eaab40e33ab129261a6d36d959295c2e891adc85a7a92186e7e214767dc","ethics":{"externalNetwork":false,"externalRegistrationPerformed":false,"humanParticipants":false,"realBusinessData":false,"realCredentials":false},"evidenceEligible":false,"externalGates":["independent-dataset-author","independent-domain-review","immutable-external-timestamp","owner-run-approval","third-party-reproduction"],"externalTimestamp":null,"format":"llang-effects-preregistration-bundle","independentReproductionRecord":null,"independentlyReproduced":false,"registered":false,"sampleSizeHash":"0b48fca5327c181cc8f28a798850dd75104d75abf0ee1fcdb8f7bff2807ca8c3","version":1}
